{
  "content_batch_ids": [
    "H03-CB-H03-WC-PROD-H03-PROD-ORG001-001-SEC-001",
    "H03-CB-H03-WC-PROD-H03-PROD-ORG001-001-SEC-002",
    "H03-CB-H03-WC-PROD-H03-PROD-ORG001-001-SEC-003",
    "H03-CB-H03-WC-PROD-H03-PROD-ORG001-001-SEC-004",
    "H03-CB-H03-WC-PROD-H03-PROD-ORG001-001-SEC-005"
  ],
  "external_publication": false,
  "form": "guide",
  "holding_id": "H03",
  "knowledge_package_id": "H03-KP-ORG001-001",
  "manifest_file": "manifest.json",
  "page_count": 2,
  "pdf_file": "diy-people-search-opt-out-guide.pdf",
  "pdf_sha256": "9387de9c840a9aa2f5b77a72ffc48f0d78b8936b90e012d0707309f871c99c19",
  "product_id": "H03-PROD-ORG001-001",
  "schema_version": "die.h03.local-product-package.v1",
  "status": "LOCAL_SALE_READY_UNREVIEWED",
  "title": "DIY People-Search Opt-Out Guide",
  "validation_file": "validation.json",
  "zip_file": "diy-people-search-opt-out-guide.zip",
  "zip_sha256": "c93b149bfe139c9fe10a2dd662427720afad57ba6523d373c7d7c8e550b1fb8a"
}
